{
  "$schema": "https://json-schema.org/draft/2020-12/schema",
  "$id": "https://local.invalid/agent-task-upgrade/task-spec.schema.json",
  "title": "Agent Task Upgrade specification",
  "type": "object",
  "additionalProperties": false,
  "required": ["status", "source_intent"],
  "properties": {
    "status": {
      "type": "string",
      "enum": ["READY", "NEEDS_INPUT", "BLOCKED"]
    },
    "source_intent": {
      "type": "string",
      "minLength": 1
    },
    "context": {
      "type": "string"
    },
    "goal": {
      "type": "string"
    },
    "goal_source": {
      "type": "string",
      "enum": ["explicit", "inferred", "confirmed"]
    },
    "scenarios": {
      "type": "array",
      "items": {
        "type": "object",
        "additionalProperties": false,
        "required": ["name", "given", "when", "then"],
        "properties": {
          "name": {"type": "string", "minLength": 1},
          "given": {"type": "string", "minLength": 1},
          "when": {"type": "string", "minLength": 1},
          "then": {"type": "string", "minLength": 1},
          "and": {
            "type": "array",
            "items": {"type": "string", "minLength": 1}
          }
        }
      }
    },
    "constraints": {
      "type": "object",
      "additionalProperties": false,
      "required": ["mandatory", "preferred", "forbidden"],
      "properties": {
        "mandatory": {
          "type": "array",
          "minItems": 1,
          "items": {"type": "string", "minLength": 1}
        },
        "preferred": {
          "type": "array",
          "minItems": 1,
          "items": {"type": "string", "minLength": 1}
        },
        "forbidden": {
          "type": "array",
          "minItems": 1,
          "items": {"type": "string", "minLength": 1}
        }
      }
    },
    "questions": {
      "type": "array",
      "items": {"type": "string", "minLength": 1}
    },
    "blocked_reason": {
      "type": "string"
    }
  },
  "allOf": [
    {
      "if": {"properties": {"status": {"const": "READY"}}},
      "then": {
        "required": ["context", "goal", "goal_source", "scenarios", "constraints"],
        "properties": {
          "scenarios": {"minItems": 1}
        }
      }
    },
    {
      "if": {"properties": {"status": {"const": "NEEDS_INPUT"}}},
      "then": {
        "required": ["questions"],
        "properties": {
          "questions": {"minItems": 1}
        }
      }
    },
    {
      "if": {"properties": {"status": {"const": "BLOCKED"}}},
      "then": {"required": ["blocked_reason"]}
    }
  ]
}
