{
  "status": "READY",
  "source_intent": "Я хочу, чтобы при запросе с Content-Type: application/json, если тело не JSON, всё тело маскировалось.",
  "context": "Механизм маскирования получает запрос, заявленный как application/json, но тело может быть невалидным JSON.",
  "goal": "Исключить сохранение или вывод исходного тела запроса, заявленного как JSON, если тело не является валидным JSON, сохранив текущее поведение для валидного JSON.",
  "goal_source": "inferred",
  "scenarios": [
    {
      "name": "Полное маскирование невалидного JSON-тела",
      "given": "запрос содержит Content-Type: application/json",
      "when": "тело запроса не является валидным JSON",
      "then": "при маскировании всё тело запроса заменяется маской"
    }
  ],
  "constraints": {
    "mandatory": [
      "Не менять текущее поведение для валидного JSON"
    ],
    "preferred": [
      "Использовать существующий механизм маскирования"
    ],
    "forbidden": [
      "Добавлять новую внешнюю зависимость"
    ]
  }
}
